{
  "result_kind": "generated_build_release_admission_preview",
  "candidate_id": "example-python-api-bbbbbbbbbbbb",
  "candidate_status": "candidate_only",
  "artifact_ref": {
    "artifact_path": ".amof/generated-builds/example-python/api/artifact.json",
    "repo_path": "/workspace/repos/example-python",
    "service": "api",
    "image_digest": "sha256:bbbbbbbbbbbbbbbbbbbbbbbbbbbbbbbbbbbbbbbbbbbbbbbbbbbbbbbbbbbbbbbb"
  },
  "target_ecosystem": "example-python",
  "target_service": "api",
  "image_digest": "sha256:bbbbbbbbbbbbbbbbbbbbbbbbbbbbbbbbbbbbbbbbbbbbbbbbbbbbbbbbbbbbbbbb",
  "artifact_proof_status": "runtime_proven",
  "candidate_admission_status": "candidate_only",
  "release_admission_preview_status": "release_admitted_preview",
  "would_create_release_admission": false,
  "would_create_deploy_admission": false,
  "reasons": [
    "candidate_record_present",
    "runtime_proven",
    "candidate_only",
    "release_target_present",
    "source_ref_confirmed",
    "deploy_pull_reference_present",
    "chart_contract_present",
    "operator_preview_only_acknowledged"
  ],
  "missing_prerequisites": [],
  "refusal_conditions": [],
  "evidence_summary": {
    "build_contract_kind": "generated",
    "runtime_family": "python",
    "confidence": "accepted",
    "template_id": "python-uvicorn-distroless-v1",
    "has_build_proof": true,
    "has_runtime_proof": true,
    "liveness_signal": "port_open",
    "risk_flags": []
  },
  "preview_context": {
    "release_target": "local-dev",
    "source_ref_confirmed": true,
    "deploy_pull_reference_present": true,
    "chart_contract_present": true,
    "operator_preview_only_acknowledged": true,
    "existing_release_candidate_present": false
  },
  "evaluated_at": "2026-04-27T10:31:00Z"
}
